{
  "_spdx": "GPL-3.0-only",
  "schema": 1,
  "schema_definition": {
    "relative_path": "interface-inputs.schema.json",
    "sha256": "a7c0520ed4ae206f8b5fd5bad971005d0e57e067b114ba45ac444f9d9324ced8"
  },
  "status": "reviewed-permissive-interfaces",
  "source": {
    "source_lock": "../upstream.lock.tsv",
    "source_name": "mesa9x",
    "repository": "https://github.com/JHRobotics/mesa9x.git",
    "commit": "29b9adb44bc5ea54dc53c02b5e4b49292c6cc04f",
    "mesa_version": "23.1.9",
    "mesa_subtree": "mesa-23.1.x"
  },
  "inputs": [
    {
      "source_relative_path": "mesa-23.1.x/src/gallium/frontends/nine/nine_memory_helper.h",
      "git_blob": "8e4cde122369b91e02f205f6d7884121dea2046f",
      "bytes": 3407,
      "sha256": "882c8bb2598f1beb3de9fb4733f80a9340e9ab4418304ae7eee64230e3f7ec74",
      "license_expression": "MIT",
      "role": "nine-interface-declarations"
    },
    {
      "source_relative_path": "mesa-23.1.x/src/gallium/frontends/nine/device9.c",
      "git_blob": "10f2e7733e2aa2ebc34ab50a01f260b5996a0364",
      "bytes": 156589,
      "sha256": "67fc2f66e192c32c7e89634556c571e3dcf7b2735344fb0df1cc5630f9b8d968",
      "license_expression": "MIT",
      "role": "nine-allocator-lifecycle-caller"
    },
    {
      "source_relative_path": "mesa-23.1.x/src/gallium/frontends/nine/surface9.c",
      "git_blob": "93d5d6577395752e4e0ff851d58850d38dc165fa",
      "bytes": 33934,
      "sha256": "c2698c513b1c0994de826265ac3408b2a0da8ae85923ed64c2b9fbe1bf279191",
      "license_expression": "MIT",
      "role": "nine-pointer-lifetime-caller"
    },
    {
      "source_relative_path": "mesa-23.1.x/src/gallium/frontends/nine/texture9.c",
      "git_blob": "5843e900dddffd6d11f8bb14b9123212728555ac",
      "bytes": 14606,
      "sha256": "95ce21274e423f764895efe27356f7036e0b29354b9efd5776225443831dd10c",
      "license_expression": "MIT",
      "role": "nine-suballocation-caller"
    },
    {
      "source_relative_path": "mesa-23.1.x/src/gallium/frontends/nine/cubetexture9.c",
      "git_blob": "b78da40239e5de99fab453679244bfbb2dc9728f",
      "bytes": 13856,
      "sha256": "c77f7bd87194e4dde5eca93ed9c5584c8e8ae15198acd49bafe998e698d98dea",
      "license_expression": "MIT",
      "role": "nine-suballocation-caller"
    },
    {
      "source_relative_path": "mesa-23.1.x/src/gallium/drivers/svga/svga_screen.c",
      "git_blob": "dd26934198d3ed3e7174bed0a44fd3e76eb4be34",
      "bytes": 46069,
      "sha256": "98f9990a1dce6607ea353e4bb9209411855beddc0ed5b8d592b8f3f2e2569bc8",
      "license_expression": "MIT",
      "role": "mesa-identity-caller"
    },
    {
      "source_relative_path": "mesa-23.1.x/src/mesa/main/context.c",
      "git_blob": "9763f4de35ea01582ca2584931312e717c64f1ac",
      "bytes": 53798,
      "sha256": "50b7d1c67677dfbd74b02bacfcc0dc7254ed407c5239c3e7f8d813b06df39527",
      "license_expression": "MIT",
      "role": "mesa-version-caller"
    },
    {
      "source_relative_path": "mesa-23.1.x/src/mesa/main/version.c",
      "git_blob": "25cc619b0ba8d3d74f5e74abd1217ff44c88352e",
      "bytes": 29474,
      "sha256": "ddc513f9f7edfed471183662df60be2873ce31622a988694d1ce2916d6229424",
      "license_expression": "MIT",
      "role": "mesa-version-caller"
    }
  ],
  "excluded_implementation_paths": [
    "include/git_sha1.h",
    "win9x/nine/nine_memory_helper.c"
  ],
  "outputs": [
    {
      "relative_path": "include/git_sha1.h",
      "bytes": 525,
      "sha256": "a9fbd8a78d0ac9ae5c12f1ef6528e99f6bf9067284a3b3119ed7c9ae86a63c91",
      "license_expression": "GPL-3.0-only",
      "role": "mesa-build-identity"
    },
    {
      "relative_path": "include/nine_memory_helper.h",
      "bytes": 1473,
      "sha256": "e7aff0715a4f98a2d3aa29bdf0efd43fea8cdb2d9b70ac6b310d8a528b72cade",
      "license_expression": "GPL-3.0-only",
      "role": "nine-memory-interface"
    },
    {
      "relative_path": "src/nine_memory_helper.c",
      "bytes": 9301,
      "sha256": "b1e2f213d6cf2ced951d526e31cf74430ab0b0ce6942fe5a77f898bc65b8b0ef",
      "license_expression": "GPL-3.0-only",
      "role": "nine-resident-memory-adapter"
    }
  ],
  "claims": {
    "build_authorized": false,
    "compile_proven": false,
    "staging_authorized": false,
    "guest_install_authorized": false,
    "capability_advertisement_authorized": false
  }
}
